{
  "id": "notice",
  "state": "NOTICE",
  "severity": "warning",
  "placement": "banner",
  "text": {
    "ru": "Срок лицензии истекает через {days_left} дн.",
    "en": "License expires in {days_left} days."
  },
  "action": {
    "label": {
      "ru": "Подробнее"
    },
    "url": "https://alter-os.ru/renew"
  },
  "repeat": "daily"
}
